Login,Password,Nombre,Descripcion,Grupo departamento,Grupo cuenta
pabpas123,1oRdenadOr2!€.4,Pablo Pascual Rovira,Jefe departamento de compras,Compras,pabpas
luccol456,1oRdenadOr2!€.4,Lucia Colas Ramirez,Empleada departamento de compras,Compras,luccol
marbel789,1oRdenadOr2!€.4,Maria Belles Olivares,Jefa departamento de ventas,Ventas,marbel
carort012,1oRdenadOr2!€.4,Carlos Ortiz Estelles,Empleado departamento de ventas,Ventas,carort
lucsua345,1oRdenadOr2!€.4,Lucia Suarez Safont,Jefa departamento personal,Personal,lucsua
olinic678,1oRdenadOr2!€.4,Olivia Nicolas Bellmunt,Empleada departamento personal,Personal,olinic
